['POLI26'],['Develop skills for analyzing and resolving complex political problems.'],['6'],,Critical Policy Analysis,Politics,['6'],['6'],,['Development'],['On-site'],,['6'],['PR-POLI26-0A10001'],,['Theoretical and Historical Foundation'],Ground your political arguments using relevant concepts and theories.,['6'],['PR-POLI26-0A10001'],,['Research'],"Develop research for the construction of proposals, projects or products related to policy.",['6'],['PR-POLI26-0A10001'],['Develop Critical Thinking.'],['Statistical Data Analysis'],['6'],
['POLI26'],Applying Political Concepts and Theories to Develop Innovative Solutions for Social Problems.,['6'],,['Critical Policy Analysis'],['Politics'],['6'],['6'],,['Development'],['On-site'],,['6'],['PR-POLI26-0A10001'],,['Theoretical and Historical Foundation'],['Ground your political arguments using relevant concepts and theories.'],['6'],['PR-POLI26-0A10001'],,['Research'],"['Develop research for the construction of proposals, projects or products related to policy.']",['6'],['PR-POLI26-0A10001'],Developing innovative thinking.,Public Policy Design,['6'],
['CIEN22'],['Develop skills for analyzing and solving complex scientific problems.'],['6'],,Scientific Method,Science,['6'],['6'],,['Development'],['On-site'],,['6'],PR-CIEN22-0A2C001,,['Theoretical and Historical Foundation'],Ground your scientific arguments using relevant concepts and theories.,['6'],['PR-CIEN22-0A2C001'],,['Research'],"Develop research for the construction of proposals, projects or products related to science.",['6'],['PR-CIEN22-0A2C001'],['Develop Critical Thinking.'],['Statistical Data Analysis'],['Program'],['Learning Program Outcomes']
['POLI26'],Effective Public Policy Analysis and Design.,['6'],,Public Policy,['Subject'],['6'],['6'],,['Development'],['On-site'],,['6'],['PR-POLI26-0A10001'],,Social-Political Problem Analysis,"Causes, Local Social and Political Problems Analysis and Consequences",National and International.,['6'],['PR-POLI26-0A10001'],,['Research'],Develops research on the implementation of public policies in different contexts.,['6'],['PR-POLI26-0A10001'],Developing skills for effective communication.,Presentation and Defense Techniques of Projects.,['6']
['POLI26'],Assessment of public policy impact on society.,['6'],,['Public Policy'],['Subject'],['6'],['6'],,['Development'],['On-site'],,['6'],['PR-POLI26-0A10001'],,['Social-Political Problem Analysis'],"['Causes, Local Social and Political Problems Analysis and Consequences']",['National and International.'],['6'],['PR-POLI26-0A10001'],,['Research'],Develops research on evaluating the impact of public policies in different contexts.,['6'],['PR-POLI26-0A10001'],['Developing skills for effective communication.'],Data Analysis and Statistics,['6']
['CIEN22'],Mathematical Model Design and Application for Scientific Problem-Solving.,['6'],,Physical Sciences,['Subject'],['6'],['6'],,['Development'],['On-site'],,['6'],PR-SCI22-0A20000,,['Complex Systems Analysis.'],"Complex Systems, Determining Influencing Variables",['6'],['PR-SCI22-0A20000'],,['Research'],Develops research on the application of mathematical models to solve scientific problems.,['6'],['PR-SCI22-0A20000'],['Developing skills for effective communication.'],['Presentation and Defense Techniques of Projects.'],['6'],
['INGE26'],Industrial Automation System Design and Development.,['6'],,Industrial Engineering,['Subject'],['6'],['6'],,['Development'],['On-site'],,['6'],PR-INGE32-0A30000,,Industrial Process Analysis,Industrial Processes Analysis and Identification of Influential Variables,['6'],['PR-INGE32-0A30000'],,['Research'],Develop investigations on the application of industrial automation technologies.,['6'],['PR-INGE32-0A30000'],['Developing skills for effective communication.'],Design and Development of Prototypes.,['6'],['Program']
['POLI26'],['Effective Public Policy Analysis and Design.'],['6'],,['Public Policy'],['Subject'],['6'],['6'],,['Development'],['On-site'],,['6'],['PR-POLI26-0A10001'],,['Social-Political Problem Analysis'],"['Causes, Local Social and Political Problems Analysis and Consequences']",['National and International.'],['6'],['PR-POLI26-0A10001'],,['Research'],['Develops research on the implementation of public policies in different contexts.'],['6'],['PR-POLI26-0A10001'],['Developing skills for effective communication.'],['Presentation and Defense Techniques of Projects.'],['6']
['POLI26'],['Assessment of public policy impact on society.'],['6'],,['Public Policy'],['Subject'],['6'],['6'],,['Development'],['On-site'],,['6'],['PR-POLI26-0A10001'],,['Social-Political Problem Analysis'],"['Causes, Local Social and Political Problems Analysis and Consequences']",['National and International.'],['6'],['PR-POLI26-0A10001'],,['Research'],['Develops research on evaluating the impact of public policies in different contexts.'],['6'],['PR-POLI26-0A10001'],['Developing skills for effective communication.'],['Data Analysis and Statistics'],['6']
['CIEN22'],['Mathematical Model Design and Application for Scientific Problem-Solving.'],['6'],,['Physical Sciences'],['Subject'],['6'],['6'],,['Development'],['On-site'],,['6'],['PR-SCI22-0A20000'],,['Complex Systems Analysis.'],"['Complex Systems, Determining Influencing Variables']",['6'],['PR-SCI22-0A20000'],,['Research'],['Develops research on the application of mathematical models to solve scientific problems.'],['6'],['PR-SCI22-0A20000'],['Developing skills for effective communication.'],['Presentation and Defense Techniques of Projects.'],['6'],
['INGE26'],['Industrial Automation System Design and Development.'],['6'],,['Industrial Engineering'],['Subject'],['6'],['6'],,['Development'],['On-site'],,['6'],['PR-INGE32-0A30000'],,['Industrial Process Analysis'],['Industrial Processes Analysis and Identification of Influential Variables'],['6'],['PR-INGE32-0A30000'],,['Research'],['Develop investigations on the application of industrial automation technologies.'],['6'],['PR-INGE32-0A30000'],['Developing skills for effective communication.'],['Design and Development of Prototypes.'],['6'],['Program']
['POLI26'],Critical and Creative Analysis of Public Policies to Address Social Challenges.,['6'],,Evaluation of Policies,['Subject'],['6'],['6'],,['Development'],['On-site'],,['6'],PR-POL24-0P1A001,,['Theoretical and Historical Foundation'],Ground your public policy proposals through the application of principles from theory and history of public policy and government management from different inclusive perspectives.,['6'],['PR-POL24-0P1A001'],,['Research'],"['Develop research for the construction of proposals, projects or products using various methodologies and technological tools.']",['6'],['PR-POL24-0P1A001'],['Systemic Thinking Development'],Analysis of Complex Public Policies.,['6'],
['POLI26'],Design and evaluation of social programs to address public health problems.,['6'],,['Evaluation of Policies'],['Subject'],['6'],['6'],,['Development'],['On-site'],,['6'],['PR-POL24-0P1A001'],,['Theoretical and Historical Foundation'],['Ground your public policy proposals through the application of principles from theory and history of public policy and government management from different inclusive perspectives.'],['6'],['PR-POL24-0P1A001'],,['Research'],"['Develop research for the construction of proposals, projects or products using various methodologies and technological tools.']",['6'],['PR-POL24-0P1A001'],['Systemic Thinking Development'],Public Health Data Analysis,['6'],['Program']
['POLI26'],Analyze and Evaluate Public Policies for Effective Decision-Making in the Local and National Sphere.,['6'],,['Political Analysis'],['Subject'],['6'],['6'],,['Development'],['On-site'],,['6'],['PR-POLI26-0A10001'],,['Theoretical and Historical Foundation'],Ground public policies from a critical and analytical perspective.,['6'],['PR-POL24-0P1A001'],,['Research'],Conduct research for the evaluation of public policies and propose improvements.,['6'],['PR-POL24-0P1A001'],['Develop Critical Thinking.'],Data Analysis for Decision Making.,['6'],
['POLI26'],Design and Implement Public Policy Programs that Solve Social and Environmental Problems.,['6'],,['Political Analysis'],['Subject'],['6'],['6'],,['Development'],['On-site'],,['6'],['PR-POL24-0P1A001'],,['Theoretical and Historical Foundation'],['Ground public policies from a critical and analytical perspective.'],['6'],['PR-POL24-0P1A001'],,['Research'],['Conduct research for the evaluation of public policies and propose improvements.'],['6'],['PR-POL24-0P1A001'],['Systemic Thinking Development'],['Complex Systems Analysis.'],['6'],['Program']
['ARQ26'],Analysis and Problem-Solving in Public Policy.,['6'],,Design of Policies,['Subject'],['6'],['6'],,['Development'],['Virtual'],,['6'],['PR-POLI26-0A10001'],,['Theoretical and Historical Foundation'],Ground your design proposals through the application of principles from the theory and history of public policy from different inclusion perspectives.,['6'],['PR-INF26-0A10002'],,['Research'],"['Develop research for the construction of proposals, projects or products using various methodologies and technological tools.']",['6'],['PR-POLI26-0A10001'],['Systemic Thinking Development'],Public Policy Analysis.,['6'],
['ARQ26'],Design and Evaluation of Public Policies for Social Problem Resolution.,['6'],,['Design of Policies'],['Subject'],['6'],['6'],,['Development'],['On-site'],,['6'],['PR-POLI26-0A10001'],,['Theoretical and Historical Foundation'],['Ground your design proposals through the application of principles from the theory and history of public policy from different inclusion perspectives.'],['6'],['PR-POLI26-0A10001'],,['Research'],"['Develop research for the construction of proposals, projects or products using various methodologies and technological tools.']",['6'],['PR-POLI26-0A10001'],['Systemic Thinking Development'],Public Policy Assessment.,['6'],
SCI27,Biotechnology Problem Analysis and Resolution.,['6'],,Biotechnology,['Subject'],['6'],['6'],,['Development'],['On-site'],,['6'],['PR-SCI22-0A20000'],,['Theoretical and Historical Foundation'],Base Found Your Design Proposals through the Application of Principles from Theory and History of Biotechnology from Different Inclusion Perspectives,['6'],['PR-SCI22-0A20000'],,['Research'],"['Develop research for the construction of proposals, projects or products using various methodologies and technological tools.']",['6'],['PR-SCI22-0A20000'],['Systemic Thinking Development'],Biotechnology Information Synthesis Techniques.,['6'],
['SCI27'],Biotechnology Product Design and Evaluation for Social Problem Solving.,['6'],,['Biotechnology'],['Subject'],['6'],['6'],,['Development'],['Virtual'],,['6'],['PR-SCI22-0A20000'],,['Theoretical and Historical Foundation'],['Base Found Your Design Proposals through the Application of Principles from Theory and History of Biotechnology from Different Inclusion Perspectives'],['6'],['PR-SCI22-0A20000'],,['Research'],"['Develop research for the construction of proposals, projects or products using various methodologies and technological tools.']",['6'],['PR-SCI22-0A20000'],['Systemic Thinking Development'],Assessment of Biotechnological Products.,['6'],['Program']
Engineering Systems,Develop skills for designing and analyzing complex systems.,['6'],,Analysis of Systems,['Subject'],['6'],['6'],,['Development'],['On-site'],,['6'],PR-ING-SYS-0B1C0001,,['Theoretical and Historical Foundation'],Ground your design proposals through the application of principles from the theory and history of systems engineering.,['6'],['PR-ING-SYS-0B1C0001'],,['Research'],"['Develop research for the construction of proposals, projects or products using various methodologies and technological tools.']",['6'],['PR-ING-SYS-0B1C0001'],['Systemic Thinking Development'],['Information Synthesis Techniques.'],['6'],
['Engineering Systems'],Design and Implement Integrated Systems for Problem Solving.,['6'],,['Analysis of Systems'],['Subject'],['6'],['6'],,['Development'],['On-site'],,['6'],['PR-ING-SYS-0B1C0001'],,['Theoretical and Historical Foundation'],['Ground your design proposals through the application of principles from the theory and history of systems engineering.'],['6'],['PR-ING-SYS-0B1C0001'],,['Research'],"['Develop research for the construction of proposals, projects or products using various methodologies and technological tools.']",['6'],['PR-ING-SYS-0B1C0001'],['Systemic Thinking Development'],['Complex Systems Analysis.'],['6'],
